title,heading,content,tokens
Code of Civil Procedure (India),Summary,"The Code of Civil Procedure, 1908 is a procedural law related to the administration of civil proceedings in India.
The Code is divided into two parts: the first part contains 158 sections and the second part contains the First Schedule, which has 51 Orders and Rules. The sections provide provisions related to general principles of jurisdiction whereas the Orders and Rules prescribe procedures and method that govern civil proceedings in India.",82
Code of Civil Procedure (India),History,"To give uniformity to Civil Procedure, Legislative Council of India, enacted Code of Civil Procedure, 1858, which received the assent of Governor-General on 23 March 1859. The Code however, was not applicable to the Supreme Court in the Presidency Towns and to the Presidency Small Cause Courts. It did not meet the challenges and was replaced by Code of Civil Procedure Code, 1877. But still it did not fulfill the requirements of time and large amendments were introduced. In 1882, the Code of Civil Procedure, 1882 was introduced. With passing of time it is felt that it needed flexibility for timeliness and effectiveness. To meet these problems Code of Civil Procedure, 1908 was enacted. Though it has been amended number of times it has withstood the test of time.",161
Code of Civil Procedure (India),Civil Procedure Code (Amendment) Act 2015,"Keeping in view the establishment of Commercial Court and the provisions thereof, Civil Procedure Code (Amendment) Act, 2016 was enacted. These provisions are applicable to commercial disputes of specified value. The act clarified that the provisions of the Civil Procedure Code as amended by the Act would have an overriding effect over any rules of the High Court or of the amendments made by the state government concerned.The Code of Civil Procedure, 1908 was further amended in the year 2018",102
Judiciary of India,Summary,"The judiciary of India is a system of courts that interpret and apply the law in the Republic of India. India uses a common law system, first introduced by the British East India Company and with influence from other colonial powers and Indian princely states, as well as practices from ancient and medieval times. The constitution provides for a single unified judiciary in India.
The Indian judicial system is managed and administrated by officers. Judges of Subordinate Judiciaries are appointed by the governor on recommendation by the High Court. Judges of the High Courts and Supreme Court are appointed by the President of India on the recommendation of a collegium.
The judicial system is structured in three levels with subsidiary parts. The Supreme Court, also known as the Apex Court, is the top court and the ultimate appellate court in India. The Chief Justice of India leads that court. High Courts are the top judicial bodies in individual states, controlled and managed by state Chief Justices. Below the High Courts are District Courts, also known as subordinate courts, that are controlled and managed by District and Sessions Judges. The lower subordinate courts are Civil Court and the District Munsif Court, headed by a Sub-Judge. The higher subordinate court, Criminal Court, is headed by Chief Judicial/Metropolitan Magistrate at top and followed by ACJM /ACMM and JM/MM at the lower level.
The Executive and Revenue Courts are managed by the state government through the district magistrate and commissioner, respectively. Although the executive courts are not part of the judiciary, various provisions and judgements empower the High Courts and Session Judges to inspect or direct their operation.
The Ministry of Law and Justice at the Union level is responsible for raising issues before Parliament relating to the judiciary. It has jurisdiction to deal with the issues of any court. It also deals with the appointment of Judges of the High Courts and the Supreme Court. At the state level, the law departments of the states deal with issues regarding the High Court and the Subordinate Courts.",405
Judiciary of India,The Constitution and the Judiciary,"The Indian Constitution empowers the Judiciary to act as the Guardian of the Law. A number of provisions deal with the Judiciary's role, power, function, and officer appointments. The major provisions are:

Part V - Chapter IV - Union Judiciary i.e., Supreme Court - appointment and removal, role and function
Part VI - Chapter V - High Court - appointment and removal, role and function
Part VI - Chapter VI- Subordinate Courts - appointment and removal, role and function
Article 50 - Independence of Judiciary - separates judiciary from executive branch
Other provisions appear under parts and articles that deal with the court's responsibilities.The judiciary acts as the arbiter on legal matters. The Inner Conflict of Constitutionalism: Judicial Review and the 'Basic Structure' – India's Living Constitution: Constitution, acts as its watchdog by calling for scrutiny any act of the legislature or the executive from overstepping bounds set for them by the Constitution. It acts as a guardian in protecting the fundamental rights of the people, as enshrined in the Constitution, from infringement by any organ of the state. It also balances the conflicting exercise of power between the centre and a state or among states.
The judiciary is expected to remain unaffected by pressures exerted by other branches of government, citizens or interest groups. Independence of the judiciary is a basic and inalienable feature of the Constitution, One such protection is that no minister can suggest a name to the President, who ultimately appoints judges from a list recommended by the collegium of the judiciary. Judges of the Supreme Court or a High Court cannot be removed from office once appointed, unless a two-thirds majority of members of any of the Houses of the Parliament back the move on grounds of misconduct or incapacity. A person who has been a judge of a court is barred from practising in the jurisdiction of that court.",381
